{"claim":{"category":"COMPOSITION","claim_key":"composition-organic","conflict_refs":[],"observed_at":"2026-10-30T00:00:00Z","origin":"SELLER","role":"SUPPORTING","statement":"Crafted from 100% GOTS certified organic combed cotton","unit":null,"value":"100% Organic Cotton"},"claim_id":"a12-claim-bbbe1814b184d6483f4c831f7fcd7daa5ef0a87a4fd6eb4c60bd265f5a2b7d36","publication_status":"NOT_ATTEMPTED","reviewer_proof":null,"rights_status":"UNKNOWN","schema_version":"ProductClaimEvidence.v1","source":{"captured_at":"2026-10-30T01:10:00Z","pointer":"","raw_ref":"sha256:6ec2121caaa5fe9ae701cebc313f6173a281a91733481c7be084f33928e86540","raw_sha256":"6ec2121caaa5fe9ae701cebc313f6173a281a91733481c7be084f33928e86540","raw_size_bytes":287,"source_kind":"HUMAN_SUPPLIED","source_ref":"fixtures/claim_seller.json","source_status":"USER_SUPPLIED_NOT_LIVE_VERIFIED"},"source_status":"USER_SUPPLIED_NOT_LIVE_VERIFIED","status":"SELLER_ASSERTED","subject":{"identity_id":"a12-identity-3cd008d002df4460ce7bf3a37f863578c81af5647b3e60eb3c7cdfcc94e1b0e4","listing_id":"a12-listing-e445d6b9fe4098625296cd44a96fe5e365e8a69be5f97d37eba4b3e7b921be71","ordinal":1,"product_id":"a12-product-438218ead938d45886faa68dbd6968f1b932184c9e40ef7667587aba9c55a61c","seller_id":"a12-seller-627ec6fbf7624a348d6552be667a88de83dceaaf3f0a661faae65eb1ba717143","snapshot_id":"a12-snapshot-abcf417213b6c2ec8857e8d4396b605d6e999b363648bdb6539dddef62adea44","snapshot_raw_sha256":"7d0e09bb047065cf38ddc05336efddb07c85f7e463907245087d511bd7d0eff5","source_namespace":"fixture","source_snapshot_id":"a12-source-5ae07b62f45b397f7e73cd4993aad904f2b6b1ec7214135b8f035ca0884c1dc2","synthetic":false,"variant_id":"a12-variant-9ea03ad42ef96775a09371fbcd3b44e027d18931873bcd6c54f8a066e482e3bd","variant_key":"blue","variant_record_id":"a12-variant-record-165dc344e182d65a21f350d648ac45f4d8bfb3629ecbeb7d90813b493b97f27c"},"verification_scope":"LOCAL_BYTES_HASH_AND_REPLAY_ONLY"}