{"claim":{"category":"SAFETY","claim_key":"hypoallergenic-safety","conflict_refs":[],"observed_at":"2026-10-30T00:00:00Z","origin":"SELLER","role":"SUPPORTING","statement":"Dermatologically tested and certified safe for sensitive skin","unit":null,"value":"Passed Class I OEKO-TEX Standard"},"claim_id":"a12-claim-a682c2810bd50146b5e05662af1c4a69c5c7b08667d1791a09cf91cc38da4889","publication_status":"NOT_ATTEMPTED","reviewer_proof":{"claim_sha256":"9c424aeed700edc539fc02f1cdd7b9e89b2f3507af18c625ff0819edf1be5973","conclusion":"SUPPORTS","evidence_kind":"INDEPENDENT_TEST_REPORT","evidence_ref":"reports/ECO-CERT-2026-9988.json","evidence_ref_sha256":"sha256:f58fded1f3759a41e02c570fd2ee1cb689c1f815d6754c57484f9eabc87a1c13","evidence_sha256":"f58fded1f3759a41e02c570fd2ee1cb689c1f815d6754c57484f9eabc87a1c13","evidence_size_bytes":108,"method":"Independent blinded laboratory sample analysis","producer_ref":"lab-alias","reviewed_at":"2026-10-30T01:30:00Z","reviewer_ref":"auditor-alias","verification_scope":"EXPLICIT_REVIEW_OF_LOCAL_EVIDENCE_ONLY"},"rights_status":"UNKNOWN","schema_version":"ProductClaimEvidence.v1","source":{"captured_at":"2026-10-30T01:15:00Z","pointer":"","raw_ref":"sha256:2ef102a243b13f69d8a93aec4fc4e709794f3a173367e2be17cb2642d1272a71","raw_sha256":"2ef102a243b13f69d8a93aec4fc4e709794f3a173367e2be17cb2642d1272a71","raw_size_bytes":304,"source_kind":"HUMAN_SUPPLIED","source_ref":"fixtures/claim_verified_source.json","source_status":"USER_SUPPLIED_NOT_LIVE_VERIFIED"},"source_status":"USER_SUPPLIED_NOT_LIVE_VERIFIED","status":"INDEPENDENTLY_VERIFIED_ONLY_WITH_REAL_EVIDENCE","subject":{"identity_id":"a12-identity-3cd008d002df4460ce7bf3a37f863578c81af5647b3e60eb3c7cdfcc94e1b0e4","listing_id":"a12-listing-e445d6b9fe4098625296cd44a96fe5e365e8a69be5f97d37eba4b3e7b921be71","ordinal":1,"product_id":"a12-product-438218ead938d45886faa68dbd6968f1b932184c9e40ef7667587aba9c55a61c","seller_id":"a12-seller-627ec6fbf7624a348d6552be667a88de83dceaaf3f0a661faae65eb1ba717143","snapshot_id":"a12-snapshot-abcf417213b6c2ec8857e8d4396b605d6e999b363648bdb6539dddef62adea44","snapshot_raw_sha256":"7d0e09bb047065cf38ddc05336efddb07c85f7e463907245087d511bd7d0eff5","source_namespace":"fixture","source_snapshot_id":"a12-source-5ae07b62f45b397f7e73cd4993aad904f2b6b1ec7214135b8f035ca0884c1dc2","synthetic":false,"variant_id":"a12-variant-9ea03ad42ef96775a09371fbcd3b44e027d18931873bcd6c54f8a066e482e3bd","variant_key":"blue","variant_record_id":"a12-variant-record-165dc344e182d65a21f350d648ac45f4d8bfb3629ecbeb7d90813b493b97f27c"},"verification_scope":"LOCAL_BYTES_HASH_AND_REPLAY_ONLY"}